date,event,check_item,pass_condition,action_if_pass,action_if_fail,status
2026-05-20〜2026-05-31,候補整理・データ再確認,PER、未確認データ、決算資料、直近株価,未確認データを埋め、停止条件が増えない,6月上旬の監視対象に残す,初回テストから外す,実施中
2026-06-10,米CPI確認,インフレ再加速、米金利急騰、NASDAQ/SOX反応,金利急騰や半導体指数急落がない,半導体・高PER候補の監視継続,高PER・半導体候補を延期,予定
2026-06-15〜2026-06-16,日銀会合確認,円高ショック、日経平均急落、金融株反応,日経平均の急落や円高ショックがない,日本株候補を継続確認,予定買いを半分以下に縮小または延期,予定
2026-06-16〜2026-06-17,FOMC確認,米長期金利、NASDAQ、SOX、ドル円,米長期金利急騰とハイテク急落がない,6月18日以降の最終ゲートへ進む,半導体・高PER候補を延期,予定
2026-06-18以降,最終購入前ゲート,候補分類、PER、下落率、イベント通過結果,停止条件なし、未確認データなし、イベント悪化なし,テスト対象として再判定,監視継続または初回除外,予定