item,value,status,explanation
結論,MVP基礎データ取得は一区切り。本番の最終売買確認データは未完了,条件付き完了,株価・出来高・金利・為替・CPI/PPI・指数などは取得済み。IR正式値、コンセンサス、有料DB系は未完了。
取得済みデータ項目,10,使用可,市場データ、マクロ、イベント、TDnet直近、SEC直近、IR PDF本文/候補抽出など。
一部取得データ項目,3,限定使用,入口や反映ゲートはあるが、正式値未入力やXBRL抽出未完成のもの。
取得予定データ項目,1,未反映,業界統計など。公開ルート確認後に1系列ずつ時系列DB化する。
未取得・制約あり項目,5,現MVPでは使わない,四季報本文、有料DB、コンセンサスEPS、企業別詳細比率など。
テーマ系列取得済み,23,取得済み,FRED/Yahoo等で取得済みのマクロ・テーマ系列数。
購入前に補完したい欠損項目,22件（高優先 11件）,要確認,FCF、PER、自社株買い、EPS成長率など。銘柄ごとに正式資料で補完。
本体スコア反映,IR正式値は0件反映,未反映,IR PDF数値候補は正式値ではないため、本体スコアには勝手に反映しない。