theme_id,theme,causal_chain,evidence_series,current_snapshot,candidate_jp_examples,first_test_condition,reject_condition,status
TREND-AI-POWER,AIデータセンター電力・冷却不足,AI需要増 → データセンター増 → 電力容量/冷却/受変電/電線需要 → 設備投資・受注 → 業績反映,SOX指数、半導体ETF、米テクノロジーETF、銅価格、米天然ガス、米資本財ETF,"SOX指数: 11588.4599609375 (2026-05-15, 1年変化134.9%) / 半導体ETF: 556.3400268554688 (2026-05-15, 1年変化125.1%) / 米テクノロジーETF: 176.25999450683594 (2026-05-15, 1年変化50.4%) / 銅価格: 12528.709545454551 (2026-03-01, 1年変化28.7%) / 米天然ガス: 2.82 (2026-05-11, 1年変化-11.6%) / 米資本財ETF: 171.39999389648438 (2026-05-15, 1年変化20.6%)",6503 三菱電機 / 6501 日立 / 5802 住友電工 / 6367 ダイキン / 7011 三菱重工 / 8035 東京エレクトロン / 6857 アドバンテスト,SOX/半導体ETFが強いだけでなく、電力設備・資本財・銅など二次需要の指標も強い,高PERだけが先行し、受注・売上・利益率の確認が取れない,調査入口。個別銘柄は未スコアを含む
TREND-RATE-BANK,金利上昇・銀行/保険,CPI/PPI再加速 → 利下げ後退/日銀正常化 → 長短金利上昇 → 利ざや改善期待 → 銀行/保険株反応,米CPI、米PPI、米10年金利、日本短期金利、TOPIX銀行業ETF、米金融ETF,"米CPI: 332.407 (2026-04-01, 1年変化3.8%) / 米PPI: 283.764 (2026-04-01, 1年変化9.8%) / 米10年金利: 4.47 (2026-05-14, 1年変化-1.3%) / 日本短期金利: 0.72700 (2026-04-01, 1年変化52.4%) / TOPIX銀行業ETF: 639.7000122070312 (2026-05-15, 1年変化61.9%) / 米金融ETF: 51.099998474121094 (2026-05-15, 1年変化-0.4%)",8306 三菱UFJ / 8316 三井住友FG / 8411 みずほFG / 8766 東京海上 / 8750 第一生命HD,金利上昇が銀行株指数の相対優位につながり、信用コスト悪化が目立たない,景気悪化を伴う金利上昇、長期金利急騰による市場全体のリスクオフ,既存候補あり。銀行はPER/FCFの扱いを一般企業と分ける
TREND-YEN-RESOURCE,円安・資源・商社,ドル高/円安 → 海外利益の円換算増・資源価格影響 → 商社/外需の利益押し上げ → 還元・資本効率評価,ドル円、WTI原油、ブレント原油、米素材ETF、米資本財ETF,"ドル円: 156.64 (2026-05-08, 1年変化7.7%) / WTI原油: 101.56 (2026-05-11, 1年変化60.4%) / ブレント原油: 106.11 (2026-05-11, 1年変化62.5%) / 米素材ETF: 50.29999923706055 (2026-05-15, 1年変化16.7%) / 米資本財ETF: 171.39999389648438 (2026-05-15, 1年変化20.6%)",8058 三菱商事 / 8001 伊藤忠 / 8031 三井物産 / 8002 丸紅 / 5020 ENEOS,円安・資源指標が追い風でも、利益率・株主還元・在庫評価を確認する,資源価格下落、円高反転、商品市況依存が強すぎる,既存候補では三菱商事が少額テスト候補
TREND-NAPHTHA-CHEM,ナフサ・原油・化学品価格,原油/ナフサ高 → 原材料費増 → 価格転嫁できる企業とできない企業に差 → 利益率格差,WTI原油、ブレント原油、米素材ETF、米PPI,"WTI原油: 101.56 (2026-05-11, 1年変化60.4%) / ブレント原油: 106.11 (2026-05-11, 1年変化62.5%) / 米素材ETF: 50.29999923706055 (2026-05-15, 1年変化16.7%) / 米PPI: 283.764 (2026-04-01, 1年変化9.8%)",5020 ENEOS / 5019 出光興産 / 3407 旭化成 / 4188 三菱ケミカルG / 4005 住友化学 / 8058 三菱商事,原料高で売上が増えるだけでなく、価格転嫁率や営業利益率が維持される,原材料高で粗利率が悪化している企業。単純な化学株買いは危険,ナフサそのものは未取得。原油・素材ETFを代替指標として扱う
TREND-PRICE-PASS,物価高・価格転嫁力,CPI/PPI上昇 → 原価上昇 → 値上げできる会社だけ利益維持 → ブランド/シェア/海外展開が効く,米CPI、米PPI、米小売売上高、米素材ETF,"米CPI: 332.407 (2026-04-01, 1年変化3.8%) / 米PPI: 283.764 (2026-04-01, 1年変化9.8%) / 米小売売上高: 757085 (2026-04-01, 1年変化4.9%) / 米素材ETF: 50.29999923706055 (2026-05-15, 1年変化16.7%)",2802 味の素 / 2801 キッコーマン / 4452 花王 / 8113 ユニ・チャーム / 2502 アサヒGHD,売上だけでなく、数量・粗利率・営業利益率・値上げ後の需要減を確認する,PERが高く、利益成長が鈍化している。値上げで数量が落ちている,既存候補あり。ただし味の素はPER高めで監視止まり
TREND-DISASTER-INFRA,災害・防災・インフラ更新,災害/老朽化 → 復旧・補強・通信・電力・建設需要 → 予算/受注 → 売上・利益,米資本財ETF、銅価格、VIX、国内建設受注/防災予算は追加取得が必要,"米資本財ETF: 171.39999389648438 (2026-05-15, 1年変化20.6%) / 銅価格: 12528.709545454551 (2026-03-01, 1年変化28.7%) / VIX: 17.26 (2026-05-14, 1年変化-7.3%)",1801 大成建設 / 1802 大林組 / 1803 清水建設 / 9433 KDDI / 9501 東京電力HD / 7011 三菱重工,短期材料ではなく、補正予算・受注・通信/電力復旧の実需に接続する,思惑だけで上がる小型材料株、倫理面の説明が難しい銘柄,国内統計の追加取得が必要。現段階は根拠資料作成まで
