theme,data_to_check,candidate_examples,use_rule,caution,status
AI・半導体,SOX指数、SMH、XLK、米10年金利、VIX,8035 東京エレクトロン、6857 アドバンテスト、4063 信越化学、5803 フジクラ、6501 日立製作所,SOX/SMHが20日・60日で上向き、かつVIX急騰なしなら候補に残す。金利急騰時は高PER銘柄の投入額を下げる。,半導体は期待先行になりやすい。PER、受注、会社予想、米金利を同時確認する。単独指標で買わない。,確認表作成済み。個別決算との接続は追加実装対象。
金利上昇・銀行,米10年金利、FF金利、10年-2年金利差、TOPIX銀行ETF,8306 三菱UFJ、8316 三井住友FG、8411 みずほFG,金利が上向き、銀行ETFも上向きなら候補化。金利上昇だけでなく、信用コストと決算進捗を確認する。,景気悪化や不良債権増加があると金利上昇でも株価が弱くなる。日銀イベント前は投入額を抑える。,確認表作成済み。信用コストの自動取得は未実装。
円安・海外売上,ドル円、米金利、日本株指数、企業別海外売上比率,8058 三菱商事、7203 トヨタ、6501 日立製作所、2802 味の素,円安が続き、海外売上比率が高い企業は候補化。ただし輸入コストが重い企業は別判定にする。,海外売上比率はIRや有価証券報告書確認が必要。現時点では一部手入力・確認扱い。,為替データは取得済み。海外売上比率の自動取得は未実装。
資源・素材・ナフサ,WTI、Brent、銅価格、XLB、ナフサ価格、化学品価格,1605 INPEX、8058 三菱商事、4005 住友化学、4188 三菱ケミカル,原油・素材価格が上向きなら資源側を確認。ナフサ高は化学メーカーにコスト圧迫としても見る。,ナフサ価格や化学品価格は安定取得ルートを確認中。現時点では原油・素材ETFで代替確認。,代替指標は取得済み。ナフサ個別データは未実装。
市場不安・守り,VIX、日経平均/TOPIX、米金利、為替、出来高,9433 KDDI、9432 NTT、4452 花王、4519 中外製薬,VIX上昇や指数悪化時は、投入額を下げて守り候補を優先。現金比率を増やす判断にも使う。,守り銘柄でも下落はする。配当、業績安定性、決算悪化がないかを確認する。,市場不安の確認は実装済み。銘柄別守り判定は追加実装対象。
インフレ・コスト,CPI、PPI、為替、原油、企業別原価率、値上げ実績,2802 味の素、2801 キッコーマン、4452 花王、8113 ユニ・チャーム,CPI/PPIが高い時は、値上げできる企業か、原価上昇に負ける企業かを分ける。,売上増が値上げによるものか数量増によるものかは決算資料確認が必要。自動判定はまだ不可。,CPI/PPIは取得済み。企業別原価率・値上げ実績は未実装。