updated_at,rank,ticker,company,process,structural_rating,structural_score,moat_score,indispensability_score,demand_duration_score,revenue_connection_score,source_quality,current_candidate_connection,nisa_score,plus1_status,completion_score,role,demand_link,structural_evidence,price_risk_note,score_policy,source_url
2026/05/26 11:52,1,8035.T,東京エレクトロン,リソグラフィ前後のコータ/デベロッパ,S,90,95,95,85,75,公式・数値あり,現候補10社には未接続,,,,100社母集団への追加検討枠,AI・先端ロジック・DRAM・NANDの微細化、EUV/High NA、歩留まり改善に接続。,コータ/デベロッパ世界シェア90%、EUV/High NA向けはほぼ100%と公式説明。,半導体製造装置投資サイクル、中国規制、SOX下落、高PER局面に注意。,本体スコアへ直接加点しない。SOX下落耐性、決算、PER/PBR/ROE、+1%比較を通過してから購入検討可否へ接続。,https://www.tel.com/blog/all/20260428_001.html
2026/05/26 11:52,2,7735.T,SCREEN HD,半導体洗浄装置,A,85,88,90,82,72,公式・シェア表現あり,現候補10社には未接続,,,,100社母集団への追加検討枠,"微細化・高集積化で洗浄工程の重要性が高まる。累計出荷15,000台の実績。",枚葉式洗浄、バッチ式洗浄、スピンスクラバで世界シェアNo.1と公式説明。,装置投資サイクル、メモリ市況、中国向け規制、受注変動に注意。,本体スコアへ直接加点しない。SOX下落耐性、決算、PER/PBR/ROE、+1%比較を通過してから購入検討可否へ接続。,https://www.screen.co.jp/spe/information/spe250701
2026/05/26 11:52,3,6146.T,ディスコ,ダイシング、グラインディング、レーザーソー、精密加工ツール,A-,82,84,88,84,70,公式・需要接続あり / シェア数値は未接続,現候補10社に接続,60.9,比較上は有力,78,現候補10社の構造確認枠,HBM、先端ロジック、パワー半導体、薄化・切断・SiC加工に接続。,"半導体・電子部品製造に使う精密加工装置と加工ツールを提供。レーザーソー累計出荷4,000台超、AI/HBM等の需要接続を公式説明。",現候補10社内。1年騰落は強いが、60日最大下落が大きく、半導体サイクルに敏感。,本体スコアへ直接加点しない。SOX下落耐性、決算、PER/PBR/ROE、+1%比較を通過してから購入検討可否へ接続。,https://www.disco.co.jp/eg/news/corp/20260302.html
2026/05/26 11:52,4,6920.T,レーザーテック,EUVマスクブランクス欠陥検査、フォトマスク関連検査,A,84,88,92,80,68,公式・高シェア表現あり / 数値は未接続,現候補10社には未接続,,,,100社母集団への追加検討枠,EUV・先端リソグラフィ・検査/計測の不可欠性に接続。,EUVマスクブランクス欠陥検査装置が業界標準として採用、最先端リソグラフィで高シェアと公式説明。,期待先行・高バリュエーション・大型顧客投資の変動に注意。,本体スコアへ直接加点しない。SOX下落耐性、決算、PER/PBR/ROE、+1%比較を通過してから購入検討可否へ接続。,https://www.lasertec.co.jp/company/business.html
2026/05/26 11:52,5,6857.T,アドバンテスト,半導体テスト装置,B,70,72,78,80,55,公式ソース未接続,現候補10社には未接続,,,,ソース補完後に再評価,AIチップ、HBM、高性能半導体の検査需要に接続する仮説。,AI/HBM/先端半導体の検査需要に近いが、今回ページでは公式シェア根拠を未接続。,既に期待が乗りやすい。高PER・SOX下落・決算失望時の反応を必ず確認。,本体スコアへ直接加点しない。SOX下落耐性、決算、PER/PBR/ROE、+1%比較を通過してから購入検討可否へ接続。,
2026/05/26 11:52,6,6762.T,TDK,電子部品、受動部品、電源・センサー関連,B,65,68,64,74,65,本ページでは公式ソース未接続,現候補10社に接続,60.7,比較上は有力,95,現候補10社の補助仮説枠,AIサーバー、電源、通信、電子部品需要への接続仮説。,現候補10社内。半導体製造装置ではなく、AI・データセンター周辺の部品需要仮説として扱う。,1年騰落は強いが、半導体製造工程の高シェア銘柄とは別枠。部品サイクル・為替・顧客在庫に注意。,本体スコアへ直接加点しない。SOX下落耐性、決算、PER/PBR/ROE、+1%比較を通過してから購入検討可否へ接続。,
