field,purpose,source,score_use,priority,status,deadline
PER/PBR/ROE,割高感、資本効率、同業比較を確認する,公式決算、有価証券報告書、J-Quants、証券会社画面,購入候補スコアの質/割安、ハード除外条件,最重要,追加取得,5/27中
売上成長率・営業利益成長率,決算成長率が本当に続いているか確認する,決算短信、決算説明資料、会社IR,量的スコアの成長項目,最重要,追加取得,5/27中
決算後1日/5日/20営業日反応,良い決算が株価に反映されたか、指数に負けていないか確認する,Yahoo Finance chart API、日経平均/TOPIX比較,決算後反応スコア、中心候補から外す条件,最重要,追加取得,5/27中
同業比較,PERやROEを業種差込みで評価し、単純比較の誤差を減らす,同業候補表、公式決算、J-Quants、証券会社画面,業種別補正、割高判定,高,追加取得,5/28午前
質的テーマ確認数字,AI半導体、金利、食品値上げ、冷却などのテーマが売上・利益に接続するか確認する,会社IR、決算説明資料、業界統計、公式統計,単純加点せず、確認条件・除外条件に使用,高,追加取得,5/28午前
6月イベント後の市場条件,CPI、日銀、FOMC後の金利・為替・指数の状態を反映する,FRED、日銀、FRB、Yahoo Finance chart API,6月再判定ゲート,最重要,6月入力,6月イベント後
