person_id,broker,nisa_account,person_phone,login_status,funding_status,proxy_system,june_gate,purchase_route,next_action
本人A,未入力,未確認,未確認,未確認,未確認,未確認,未入力,判定待ち,口座・ログイン・投資可能額を確認
本人B,未入力,未確認,未確認,未確認,未確認,未確認,未入力,判定待ち,本人発注可能か確認
本人C,未入力,未確認,未確認,未確認,未確認,未確認,未入力,判定待ち,代理制度確認対象にする
本人D,未入力,未確認,未確認,未確認,未確認,未確認,未入力,判定待ち,口座開設が必要か確認
route,A 正式代理,代理人制度がNISA注文まで対応し再来週に間に合う,代理手続確認表と本人別注文票,6月ゲート通過後に購入候補
route,B 本人発注,代理制度は使えないまたは間に合わないが本人が発注できる,本人別注文票と発注チェックリスト,6月ゲート通過後に購入候補
route,C 中期移行,初回は本人発注で継続運用では代理制度・IFA・NISAラップへ移行,初回注文票と中期移行メモ,初回は条件付き
route,D 購入延期,NISA口座・本人操作・代理制度のいずれも整っていない,延期理由と必要準備リスト,今回は購入しない
