person_id,buy_date,broker,account_type,investment_amount,tickers_and_weights,do_not_buy_conditions,order_method,status
本人A,6/18以降,未入力,NISA成長投資枠,未入力,候補10社から6月ゲート通過後に入力,"CPI悪化、日銀後円高、FOMC後金利急騰、指数急落、決算後反応悪化",本人スマホ・本人ログイン・本人発注,準備中
本人B,6/18以降,未入力,NISA成長投資枠,未入力,候補10社から6月ゲート通過後に入力,"CPI悪化、日銀後円高、FOMC後金利急騰、指数急落、決算後反応悪化",本人スマホ・本人ログイン・本人発注,準備中
本人C,6/18以降,未入力,NISA成長投資枠,未入力,候補10社から6月ゲート通過後に入力,"CPI悪化、日銀後円高、FOMC後金利急騰、指数急落、決算後反応悪化",本人スマホ・本人ログイン・本人発注,準備中
check,NISA口座,本人名義でNISA成長投資枠が使えるか,未確認なら購入停止,証券会社画面で口座区分を確認
check,本人ログイン,本人スマホで本人がログインできるか,未確認なら購入停止,本人がログインと2段階認証を完了
check,入金,投資予定額が証券口座に入っているか,未確認なら購入延期,買付余力が注文額以上
check,6月イベント,CPI・日銀・FOMC後の市場反応が停止条件に該当しないか,該当なら注文票を無効化,6月ゲート判定エンジンが購入候補
check,候補銘柄,決算後反応・指数比較・未取得データ・過熱を確認したか,未確認銘柄は保留,候補別の扱いが入力済み
check,本人確認,本人が銘柄・金額・リスクを確認したか,未確認なら購入停止,本人が発注内容を確認
