gate,default_status,required,ok_handling,stop_condition
市場イベント,未確認,CPI、日銀、FOMC後の市場ゲートが緑または黄であること。,緑なら通常検討、黄なら保守配分。,赤なら購入停止。
候補10社,一部確認,中心候補に必要な公式決算・PER/PBR/ROE・テーマ根拠が確認されていること。,中心候補、条件付き、補欠が分かれている。,未確認データを点数に混ぜている銘柄は購入候補にしない。
配分,暫定,市場ゲートに応じた個別株比率、現金待機率、銘柄別上限が決まっていること。,緑・黄で配分上限を切り替える。,比率未定なら注文金額を確定しない。
NISA口座,未確認,本人名義、本人ログイン、本人操作、NISA口座区分、NISA残枠が確認済みであること。,本人が証券会社画面で確認して発注する。,本人操作・口座区分・残枠が未確認なら購入停止。
税制確認,一部確認,NISA損失は損益通算不可、配当・外国税・課税口座との違いを確認していること。,税制レイヤーは補助表示として扱う。,税務判断が必要なものを買い推奨に混ぜない。
記録,未確認,購入理由、買わない条件、期待値、比較指数、撤退条件を記録できること。,CSVまたは運用記録に残す。,記録できない場合はテストとしての検証価値が下がる。
指数比較,暫定,S&P500、TOPIX、日経平均との12か月比較と、劣後時の比率引き下げルール(915)があること。,12か月で指数+1%以上を説明できる根拠がある。,12か月で+1%の説明が成立しないなら個別株比率を上げない。
