scenario,return_pct,full_240m_result_yen,full_240m_profit_yen,initial_36m_result_yen,initial_36m_profit_yen,basis,action
上振れ,29.0,"2,992,354円","592,354円","464,533円","104,533円",上昇確率モデルの上昇幅を比率加重,利確ではなく、決算・指数超過・出来高を確認して一部利益確保を検討
通常EV仮説,11.1,"2,625,648円","225,648円","399,820円","39,820円",上昇確率×上昇幅 - 下落確率×下落幅 - コスト,この水準が指数+1%を説明できるか確認
下値確認ライン到達,-7.1,"2,256,061円","-143,939円","334,599円","-25,401円",銘柄別の一時停止ラインを比率加重,新規買付停止。理由確認まで追加しない
下振れ,-14.8,"2,097,586円","-302,414円","306,633円","-53,367円",下落幅モデルを比率加重,個別株比率を下げ、現金またはインデックスへ戻す
直近1年最大下落級,-20.2,"1,988,726円","-411,274円","287,422円","-72,578円",各銘柄の直近1年最大下落を比率加重,想定外ではなくストレスとして扱い、追加停止・減額
5年最大下落級,-35.3,"1,679,422円","-720,578円","232,839円","-127,161円",各銘柄の5年最大下落を比率加重,短期テストの範囲を超える。購入計画を再設計
一律-10%機械ストレス,-10.0,"2,196,000円","-204,000円","324,000円","-36,000円",全銘柄が同時に-10%下落する仮定,ストップ安相当ではなく、急落時の資金ダメージ確認用
